Empresa,Años Experiencia,Email,Estado,Facturación Estimada,Notas,Notas Investigación,Presencia Digital,Prioridad,Provincia/País,Score ModulorIA,Tamaño Estimado,Teléfono,Ubicación,Web,Certificaciones,Sector,LinkedIn,Facebook,Instagram,Sector Específico,Fecha Primer Contacto,Servicios Potenciales,YouTube,Twitter/X,Última Interacción
Viviendas VME,20,info@viviendademadera.es,🆕 Sin Contactar,💶 1-5M€,Chalets y casas pasivas prefabricadas,"EMPRESA 20 AÑOS Sueca, Valencia. Razón social: VM Ecogroup S.L. Especialistas CASAS PASIVAS prefabricadas alta calidad. Portfolio: +300 viviendas construidas en Madrid, Valencia, Barcelona. Sistema: Entramado ligero madera + hormigón + acero (Ossature Bois francés). CERTIFICACIONES: Casas Pasivas / nZEB (edificios consumo casi nulo). Materiales: OSB3, madera laminada GL24H, aislamiento ideal Passivhaus, PVC triple vidrio, sistema SATE fachadas. Precios: Desde 86K€ (modelos 100m2) hasta 267K€ (241m2). Facilidades pago. Target: B2C consumidor final clase media-alta. Plazos: Rápidos vs obra tradicional. ⚠️ PRESENCIA DIGITAL: Facebook (mencionado repetidamente), NO LinkedIn empresa, NO Instagram encontrado = Señal PREOCUPANTE. FOROS: Reputación MIXTA - Constructora tradicional reconvertida, obras subcontratadas a fabricantes. Fit ModulorIA MEDIO-ALTO: Especialización Passivhaus POSITIVA (+300 casas, 20años), pero falta presencia digital profesional LinkedIn/Instagram critica.",⚠️ Regular,⭐ Media,Valencia,⭐⭐⭐ Buen Fit,🏬 Mediana (20-50 empleados),642 231 672 / 643 037 823,"C. Villa Corbera, 22, 46410 Sueca, Valencia",viviendasvme.es,Passivhaus,,No encontrado,"Construcción de Viviendas VME (mencionado, URL no encontrada)",No encontrado,"Hormigón, Madera, Passivhaus, Sostenible/Eco",,,,,
Prefabrik,,,🆕 Sin Contactar,,Casas prefabricadas baratas. Controles rigurosos calidad,,,⭐ Media,Sevilla,,,,Sevilla,prefabrik.es,,,,,,,,,,,
Modular Home Alicante,,alicante@modularhome.es,🆕 Sin Contactar,,Delegación Alicante. Casas modulares desde 57.231€,"Delegación Alicante (Elche). Contacto de delegación verificado en web oficial: mailto:alicante@modularhome.es, 696 59 69 86, Calle Panamá 1, planta 3, oficina 4, 03205 Elche (Alicante). Redes oficiales de la marca Modular Home: IG, FB, LinkedIn, X.",,⭐ Media,Alicante,,,696 59 69 86,Alicante,modularhome.es,,,https://es.linkedin.com/company/casas-modular-home,https://www.facebook.com/modularhome.es,https://www.instagram.com/modular_home/,,,,,https://twitter.com/modular_home,
Forest House,,info@foresthouse.es,🆕 Sin Contactar,,Casas de madera Passivhaus. Alto aislamiento A+,"FOREST HOUSE - Especialista CASAS MADERA PREFABRICADAS Barcelona. Construcción ECOLÓGICA y SOSTENIBLE. Máximas calificaciones energéticas. Construcción innovadora para todo tipo terrenos. Servicios: Construcción casas madera, Rehabilitación edificios, Casetas jardín, Pérgolas exteriores. Enfoque: Construcción general + carpintería madera. Proyectos exteriores revalorizan jardines/terrazas. Gama completa casetas jardín (almacenaje herramientas, oficinas, taller bricolaje). Material: MADERA como protagonista. Aislante natural renovable. Target: Clientes Barcelona y Cataluña buscando viviendas ecológicas madera. También hoteles (construcción apartamentos Sierra Nevada Granada). +20 años experiencia sector según algunas fuentes.",⚠️ Regular,⭐ Media,Barcelona,⭐⭐⭐ Buen Fit,🏪 Pequeña (5-20 empleados),935 127 202,"Sant Martí, Barcelona",foresthouse.es,,,,,,,,,,,
Ideas Exteriores,,info@gloci.es,🆕 Sin Contactar,💶 1-5M€,ESTUDIO ARQUITECTURA CANARIAS. Steel frame + CLT. Premio Miguel Martín Fernández de la Torre. Reducción 50% tiempos.,"GLOCI - ESTUDIO ARQUITECTURA especializado VIVIENDAS INDUSTRIALIZADAS Canarias. Tel: +34 628 016 921. Email: mailto:info@gloci.es. Web: http://gloci.es. Redes: Instagram, LinkedIn, Facebook. Sistemas constructivos: STEEL FRAME + CLT (madera contralaminada). Filosofía: industrialización proceso constructivo. Ventajas: REDUCCIÓN 50% TIEMPOS ejecución, minimiza residuos, estándar calidad superior vivienda tradicional. Servicios: viviendas modulares catálogo + vivienda medida personalizadas. Diseño basado experiencia humana + conocimiento entorno. PREMIO MIGUEL MARTÍN FERNÁNDEZ DE LA TORRE por Casa de las Cuevas (arquitectura industrial con alma canaria). Aparición La Provincia. Target: Clientes Canarias buscando arquitectura contemporánea industrializada con identidad local.",✅ Buena,🔥 Alta,Toledo,⭐⭐⭐⭐⭐ Excelente Fit,🏪 Pequeña (5-20 empleados),+34 628 016 921,"Yuncos, Toledo",ideas-exteriores.com,,"Modular Madera, Prefabricadas, Sostenible",https://arquitecturaligera.com/contacto/,https://piscinasmodulares.com/,https://arquitecturaligera.com/wp-content/plugins/revslider/public/assets/assets/dummy.png,"Madera, Prefabricados, Residencial, Sostenible/Eco",,,,,
ARQUIMA,,info@arquima.net,🆕 Sin Contactar,,Construcción madera industrializada,"ARQUIMA - Empresa Barcelona especializada CONSTRUCCIÓN INDUSTRIALIZADA MODULAR. Estructura MADERA. Muchos años experiencia mercado nacional. Proceso expansión internacional. Dos sistemas constructivos: Sistema Envolvente SEA y Sistema construcción altura Ca2d. Permite manufacturar cualquier tipo proyecto edificación: Oficinas, viviendas, educación, senior housing, student housing. Construcción fábrica + montaje sitio. ARQUIMA Design: Colección modelos diseñados arquitectos únicos. Sostenibilidad construcción modular madera. Participación BBC2019 Barcelona Building Construmat. Target: Profesionales arquitectura, promotores, clientes particulares buscando construcción industrializada madera.",🚀 Excelente,🔥 Alta,Barcelona,⭐⭐⭐⭐⭐ Excelente Fit,🏬 Mediana (20-50 empleados),936 821 006,Barcelona/Valencia,arquima.net,,,,,,,,,,,
The Concrete Home,40,,🆕 Sin Contactar,💵 5-10M€,Casas prefabricadas hormigón a medida. Sistema TCH. 6 meses,"THE CONCRETE HOME S.L. - Casas prefabricadas HORMIGÓN premium. Fundada 2015. Sede: Torrelodones, Madrid. OFICINA MÁLAGA: Tel +34 951 23 93 03, Alameda de Colón, 9. Web: http://theconcretehome.com. 14 EMPLEADOS (+10% YoY). $5.5M FACTURACIÓN. +30 AÑOS experiencia construcción tradicional + innovación prefabricados. PROYECTO LLAVE EN MANO presupuesto cerrado. Plazo: MÁXIMO 8 MESES. Ahorro: hasta 4.000€/año facturas suministros. Máxima eficiencia energética. Proyectos terminados: Majadahonda (240m²), Torrelodones (210m²), Galapagar (150m²), Colmenarejo, Pozuelo de Alarcón. 15 proyectos en Homify. Target: Clientes Madrid/Málaga buscando hormigón premium precio cerrado.",,🔥 Alta,Madrid,⭐⭐⭐⭐⭐ Excelente Fit,🏪 Pequeña (5-20 empleados),+34 951 239 303,"Torrelodones, Madrid",theconcretehome.com,,,,,,,,,,,
Panelais Producciones,,,🆕 Sin Contactar,,Líder paneles sándwich. 100.000m2 instalaciones. LOCAL Salamanca,,,🔥 Alta,Salamanca,,,923 19 11 75,"Huerta, Salamanca",panelais.com,,,,,,,,,,,
Mobilhouse A/S,73,,🆕 Sin Contactar,,+60 años. Construcción modular flexible y sostenible,"MOBILHOUSE A/S - ⚠️ EMPRESA DANESA (Dinamarca), NO española. Fundada 1952. Sede: Fredericia (2 plantas fabricación) + Bjæverskov (oficinas, almacén, ensamblaje final). Fabricación, venta y arrendamiento EDIFICIOS MODULARES. Productos: Oficinas, escuelas, viviendas estudiantes, alojamiento temporal, casetas obra. 2019: Adquirida por Adelis Equity. 2023: Adquirió Dalsgaard (empresa construcción Vejle). Crecimiento acelerado objetivo. Mercado: Principalmente Dinamarca países nórdicos. Target: Sector construcción educación alojamiento temporal necesitando espacios modulares. ⚠️ NO opera España - empresa danesa mercado nórdico.",✅ Buena,💤 Baja,Dinamarca,⭐ Bajo Fit,🏬 Mediana (20-50 empleados),,Fredericia,mobilhouse.dk,,,,,,,,,,,
AP Modular Mallorca,,info@apcasasmodulares.com,🆕 Sin Contactar,,Casas modulares a medida. Personalización completa,,,⭐ Media,Baleares,,,971 760 500,07199 Palma,apcasasmodulares.com,,,,,,,,,,,
Fortuna Casas Prefabricadas,,,🆕 Sin Contactar,,Casas prefabricadas personalizadas,"FORTUNA CASAS PREFABRICADAS - Empresa Murcia especializada CASAS Y CABAÑAS MADERA. Gamas: Cabañas madera 8-20m², Casas madera 20-80m², Villas madera 80-180m². Proceso simplificado compra rápido sin complicaciones. Colección constante crecimiento. Instalación: 24 HORAS desde entrega. Montaje rápido sencillo (construcción completa semanas). NO requieren obra ni papeleo burocrático. Mobiliario modernista incluido. Equipamiento cocina completo. Target: B2C clientes buscando cabañas/casas madera vacaciones o primera vivienda. Enfoque: Calidad, diseño, sostenibilidad. Precios competitivos vs construcción tradicional. Web enfocada catálogo visual inspirador.",✅ Buena,💤 Baja,Murcia,⭐⭐ Fit Medio,🏠 Micro (<5 empleados),,Murcia,fortunacasasprefabricadas.com,,"Modular Madera, Prefabricadas",,,,"Madera, Residencial",,,,,
Modular Home,21,info@modularhome.es,🆕 Sin Contactar,💰 >10M€,Casas hormigón. Sistema MH System,LÍDER NACIONAL. Sistema MH System® propio. +110 empleados. 27K seguidores Instagram. Franquicias Modulate. España/Portugal. Proyecto CDTI.,🚀 Excelente,⭐ Media,Sevilla,⭐⭐⭐⭐⭐ Excelente Fit,🏢 Grande (50+ empleados),900 102 368,España,modularhome.es,CE,,https://es.linkedin.com/company/casas-modular-home,https://www.facebook.com/modularhome.es,https://www.instagram.com/modular_home/,"Hormigón, Prefabricados, Residencial, Sostenible/Eco",,,https://www.youtube.com/modularhome,https://twitter.com/modular_home,
Alucasa,,info@alucasa.com,🆕 Sin Contactar,,Casas móviles prefabricadas. Fábrica propia,"Alucasa (Residenciales Móviles, S.A.) - Contacto verificado en web oficial: Paraje de las Bóvedas, 96 (Polígono El Raiguero), 03160 Almoradí, Alicante. Tel. +34 965 702 697. Email mailto:info@alucasa.com. Redes enlazadas en la web: Facebook, Instagram, YouTube, X y TikTok. LinkedIn corporativo: https://www.linkedin.com/company/alucasa/",✅ Buena,💤 Baja,Alicante,⭐⭐ Fit Medio,🏪 Pequeña (5-20 empleados),965 702 697,"Almoradí, Alicante",alucasa.com,,,https://es.linkedin.com/company/alucasa?trk=public_post_feed-actor-image,https://www.facebook.com/Alucasa,https://www.instagram.com/alucasa_mobilehomes/,,,,https://www.youtube.com/user/Alucasas,https://twitter.com/_Alucasa,
Scandi Byg,,,⏸️ En Pausa,,Mayor fabricante DK. 45+ años. 175 empleados. DGNB,"SCANDI BYG - BANCARROTA ENERO 2025. Fundada 1978. Sede: Himmerlandsvej 3, Løgstør, Dinamarca. Tel: +45 9867 2500. Especialista construcción modular Dinamarca. NUEVO CEO (marzo 2025): Mads Seneca Simonsen (14 años experiencia en la empresa, antes Development Manager). Nordic Wood Industries adquirió activos. Plan de continuación anunciado enero 2025 - completar proyectos en curso y recontratación parcial plantilla. Premio innovación robot IA (único en Dinamarca). Target: PRECAUCIÓN - empresa en reestructuración post-bancarrota.",,🔥 Alta,Dinamarca,,,+45 9867 2500,Løgstør,scandibyg.dk,,,,,,,,,,,
Modular Home Toledo,,info@modularhome.es,🆕 Sin Contactar,,Casas prefabricadas eficientes y personalizadas,,,⭐ Media,Toledo,,,900 102 368,Toledo,modularhome.es,,,,,,,,,,,
Casas inHAUS,10,,🆕 Sin Contactar,💰 >10M€,LÍDER casas modulares hormigón alta gama. 111 modelos. Fábrica +4.000m² Valencia. 16.5M€ (2024). +41% crecimiento.,"CASAS INHAUS S.L. - LÍDER casas modulares prefabricadas HORMIGÓN alta gama España. Fundada 2015. Sede: Calle Maestro Calve 1-10, 46001 Valencia. Fábrica/Showroom Almussafes (+4.000m²). Tel: 963 519 219 / 900 102 961. Email: mailto:hola@casasinhaus.com. NIF: B98533953. 19 EMPLEADOS (+10.2% YoY). FACTURACIÓN 16.5M€ (2024), CRECIMIENTO +41%. 111 MODELOS catálogo (20 nuevos). 5 MESES fabricación nave + 15 días montaje terreno. Proceso llave en mano TODO INCLUIDO. Servicio integral 100% personalizado. Premio CEEI trayectoria empresarial. Exportación EEUU (éxito internacional). Jornadas puertas abiertas InHAUS Lab. Target: Clientes alta gama lujo.",🚀 Excelente,🔥 Alta,Valencia,⭐⭐⭐⭐⭐ Excelente Fit,🏪 Pequeña (5-20 empleados),963 519 219,Valencia (Opera en toda España incl. Barcelona),https://casasinhaus.com,,"Construcción Industrializada, Modular Hormigón, Prefabricadas",https://linkedin.com/company/casas-inhaus,,,"Hormigón, Lujo/Alta Gama, Residencial",,"Análisis Datos, Automatización Procesos, CRM/ERP",,,
GoPrefabricadas,25,,🆕 Sin Contactar,,,25+ años experiencia. Construcción sostenible con experiencia europea. Sin LinkedIn. Casas prefabricadas madera.,⚠️ Regular,⭐ Media,Barcelona,⭐⭐⭐ Buen Fit,❓ Desconocido,+34 683 18 61 50,Barcelona,https://goprefabricadas.com,,"Modular Madera, Prefabricadas, Sostenible",,,,"Madera, Residencial, Sostenible/Eco",,"CRM/ERP, Marketing Digital",,,
The Concrete Home,40,,🆕 Sin Contactar,💵 5-10M€,PREMIUM noroeste Madrid. 40 años (desde 1984). 14 empleados. $5.5M. Hormigón prefabricado. 8 meses máx.,"THE CONCRETE HOME S.L. - CASAS HORMIGÓN PREFABRICADO PREMIUM. Fundada 2015 como marca, vinculada construcción desde 1984 (40 AÑOS experiencia). Torrelodones, Madrid. 14 EMPLEADOS (+10% YoY). Facturación $5.5M. Web: http://theconcretehome.com. Tel Madrid: 951 239 303. Módulos hormigón armado 12-20cm espesor. Construcción máximo 8 MESES. Ahorro 4.000€/año facturas. Proyectos: Torrelodones, Majadahonda (240m²), Galapagar (150m²), Colmenarejo, Las Rozas, Peñascales. 15 proyectos Homify. Modelos: Zermatt, Praga. Target: Clientes ALTA GAMA zona noroeste Madrid.",🚀 Excelente,🔥 Alta,Madrid,⭐⭐⭐⭐⭐ Excelente Fit,🏪 Pequeña (5-20 empleados),951 239 303,"Torrelodones, Madrid",https://theconcretehome.com,,"Modular Hormigón, Prefabricadas",https://linkedin.com/company/the-concrete-home,,,"Hormigón, Residencial",,"CRM/ERP, Marketing Digital",,,
Casas Cube,12,info@casascube.com,🆕 Sin Contactar,💶 1-5M€,,"CASAS CUBE S.L. - LÍDER España casas prefabricadas modulares. Sede: Polígono de Bértoa, Carballo (A Coruña). Tel: 981 632 547. Email: mailto:info@casascube.com. Web: http://casasprefabricadascube.com. CIF: B70409875. 10 EMPLEADOS (+30% YoY). Facturación $1.3M. Fundada 2013. LinkedIn: 1,986 seguidores. PUNTOS DE VENTA: La Coruña (Marineda City), Madrid (C.C.Xanadú), Asturias (C.C.Azabache). Fábrica: 30.000m² + 250 profesionales. Modelos desde 36 hasta 300m². PRECIO CERRADO desde inicio. Construcción pocos meses. Transporte e instalación incluidos. Sistema CUBE: Entorno industrial controlado. Redes: Facebook + Instagram verificados. Target: Nacional, clase media-alta buscando vivienda eficiente precio cerrado.",✅ Buena,⭐ Media,Valencia,⭐⭐⭐ Buen Fit,🏪 Pequeña (5-20 empleados),981 632 547,"Rúa da Madeira, Parcela E-4, Polígono de Bértoa, 15100 Carballo, A Coruña",https://casascube.es,,"Modular Hormigón, Prefabricadas",,https://facebook.com/casascube,https://instagram.com/casascube,"Hormigón, Residencial",,"CRM/ERP, Marketing Digital",,,
KUB'S House,,,🆕 Sin Contactar,,,"KUB'S HOUSE - Contacto verificado en web oficial: Carrer del Ter 41, 17451 Sant Feliu de Buixalleu (Girona). Tel. 689 82 59 84. Redes oficiales enlazadas en web: Instagram, YouTube, Facebook y LinkedIn.",✅ Buena,⭐ Media,Barcelona,⭐⭐ Fit Medio,🏠 Micro (<5 empleados),689 82 59 84,"Sant Feliu de Buixalleu, Girona",https://kubshouse.com,,"Modular Madera, Prefabricadas",https://es.linkedin.com/company/kubshouse,https://www.facebook.com/kubshouse,https://www.instagram.com/kubshouse/,"Lujo/Alta Gama, Madera, Residencial",,"CRM/ERP, Marketing Digital",https://www.youtube.com/@kubshouse6719,,
Hormipresa,50,comercial@hormipresa.com,🆕 Sin Contactar,💰 >10M€,División LIVING para viviendas residenciales. Email comercial: mailto:comercial@hormipresa.com / Email Living: mailto:living@hormipresa.com,"HORMIPRESA - 50+ años experiencia. Dirección: León XIII, 24, 08022 Barcelona. Fax: (34) 933.339.801. DOS DIVISIONES: Industrial (prefabricados hormigón) y LIVING (viviendas premium). Líderes España construcción industrializada hormigón. Edificios terciarios gran escala, construcción altura, viviendas alta gama. Tecnologías: BIM, impresión 3D, sistemas Hybrid Wall y Arctic Wall. Casas en 7 meses. Proyectos: Casa Maresme, Sant Cugat, Bellaterra, Girona, Golf Camiral, Tarragona. Web Living: http://hormipresaliving.com. Miembro ACE. Redes verificadas: Instagram, Facebook, YouTube, LinkedIn.",🚀 Excelente,🔥 Alta,Barcelona,⭐⭐⭐⭐⭐ Excelente Fit,🏢 Grande (50+ empleados),+34 934 470 322,Barcelona,https://hormipresa.com,,"Construcción Industrializada, Modular Hormigón, Prefabricadas",https://linkedin.com/company/hormipresa,https://www.facebook.com/hormipresa,https://instagram.com/hormipresa,"Hormigón, Industrial, Prefabricados, Residencial",,,https://www.youtube.com/hormipresa,,
Arcitur Homes,,,🆕 Sin Contactar,,,Especialistas casas modulares Barcelona. Alta eficiencia energética. Poca presencia digital.,⚠️ Regular,⭐ Media,Barcelona,⭐⭐ Fit Medio,❓ Desconocido,,Barcelona,https://arciturhomes.com,,"Modular Hormigón, Prefabricadas",,,,"Prefabricados, Residencial, Sostenible/Eco",,Marketing Digital,,,
Hormitech,9,web@hormitech.es,🆕 Sin Contactar,💵 5-10M€,,"HORMITECH - Casas prefabricadas hormigón. Fundada 2016. 18 EMPLEADOS. Opera en 5 países. +3,400 VIVIENDAS entregadas. MAYOR DISTRIBUIDORA España. Sedes: Las Rozas, Madrid (C/ Mahón 10, 1ºB, 28290) + Marbella, Málaga (C/ 19, Edif. Banús Guadalmina). Tel: 919 491 900. Web: http://hormitech.es. Proyectos llave en mano desde 250.000€. Precios según superficie: 115-600m². Target: Clientes buscando viviendas prefabricadas hormigón gama media-alta.",🚀 Excelente,🔥 Alta,Madrid,⭐⭐⭐⭐ Muy Buen Fit,🏪 Pequeña (5-20 empleados),919 491 900,"Las Rozas, Madrid + Marbella",https://hormitech.es,,"Construcción Industrializada, Modular Hormigón, Prefabricadas",https://linkedin.com/company/hormitech,,https://instagram.com/hormitech,"Hormigón, Residencial",,"Análisis Datos, Automatización Procesos, CRM/ERP",,,
Cronotopos Arquitectura,8,,🆕 Sin Contactar,,,"Cronotopos Arquitectura (registro duplicado/incorrecto) - Esta fila parece referirse a otra entidad (menciona México y rehabilitación). Para modular en España, usar la ficha 'Cronotopos Arquitectura' con web http://cronotopos.es y mailto:contacto@cronotopos.es. Recomiendo revisar/eliminar esta entrada para no mezclar datos.",❓ Sin Evaluar,💤 Baja,Alicante,❓ Por Evaluar,🏪 Pequeña (5-20 empleados),,Zaragoza / Alicante,https://cronotopos.es,,"Construcción Industrializada, Prefabricadas",,,,"Prefabricados, Residencial",,"Análisis Datos, CRM/ERP, Marketing Digital",,,
Studio HC,10,info@studiohc.es,🆕 Sin Contactar,,,"Studio HC - Contacto verificado en web oficial: Calle Pardo Gimeno 11C, 03007 Alicante (también sede en Valencia con cita previa). Tel. 966 275 331. Email mailto:info@studiohc.es. Redes enlazadas en web: Instagram, Facebook, Pinterest y LinkedIn.",✅ Buena,⭐ Media,Alicante,⭐⭐⭐ Buen Fit,🏪 Pequeña (5-20 empleados),966 275 331,Alicante,https://studiohc.es,,"Modular Acero, Modular Hormigón, Modular Madera",https://www.linkedin.com/company/grupo-studio-hc/?originalSubdomain=es,https://www.facebook.com/studio.hc.arq/,https://www.instagram.com/studiohc/?hl=es,"Acero/Steel Frame, Madera, Residencial",,"CRM/ERP, Marketing Digital",,,
ARQUIMA,18,info@arquima.net,🆕 Sin Contactar,💶 1-5M€,,"ARQUIMA - Contacto verificado en web oficial: CENTRAL (Abrera, Barcelona) Tel. 936 821 006 y email mailto:info@arquima.net. En la página de contacto aparecen también contactos por zona (Baleares, Levante, etc.).",🚀 Excelente,🔥 Alta,Barcelona,⭐⭐⭐⭐⭐ Excelente Fit,🏪 Pequeña (5-20 empleados),936 821 006,"Abrera, Barcelona",https://arquima.net,"LEED, Passivhaus","Modular Madera, Passivhaus, Sostenible",https://linkedin.com/company/arquima,,https://instagram.com/arquima_oficial,"Madera, Passivhaus, Residencial, Sostenible/Eco",,"Automatización Procesos, CRM/ERP, Marketing Digital",,,
Modular Home,,,🆕 Sin Contactar,,,LinkedIn 86 seguidores. Modelo franquicia nacional. Red de distribuidores.,⚠️ Regular,⭐ Media,Valencia,⭐⭐⭐ Buen Fit,🏢 Grande (50+ empleados),,Nacional (Franquicia),https://modularhome.es,,"Modular Hormigón, Prefabricadas",https://linkedin.com/company/modular-home-spain,,,"Hormigón, Residencial",,"CRM/ERP, Marketing Digital",,,
Emsamble,8,,🆕 Sin Contactar,,,8 empleados (+18.8% YoY). Fundada 2017. Especialistas casas pasivas. Arquitectura industrializada.,✅ Buena,⭐ Media,Valencia,⭐⭐⭐ Buen Fit,🏠 Micro (<5 empleados),,"Oleiros, Galicia (Proyectos en Valencia/Barcelona)",https://emsamble.com,,"Passivhaus, Prefabricadas, Sostenible",,,,"Passivhaus, Residencial, Sostenible/Eco",,"CRM/ERP, Marketing Digital",,,
Atlántida Homes,60,info@atlantidahomes.com,🆕 Sin Contactar,💰 >10M€,GRUPO RIOFRÍO (60+ años). Hormigón + acero. Configurador web pionero. 4 meses entrega. Precio cerrado.,"ATLÁNTIDA HOMES - División industrializada GRUPO RIOFRÍO (+60 años sector inmobiliario). Tel: +34 914 09 71 80. Web: http://atlantidahomes.com. LinkedIn: 769 seguidores. Casas prefabricadas HORMIGÓN + ACERO (estructura similar construcción tradicional). CONFIGURADOR WEB PIONERO mundial - cliente configura modelo/acabados y ve precio instantáneo. Plazo fijo 4 MESES. PRECIO CERRADO. Servicio llave en mano: estudio viabilidad urbanística, estudio energético, topografía, geotécnico, proyecto básico/ejecución, certificado eficiencia, dirección facultativa. Modelos: Arena, Duna (desde 237.750€). Operan: Madrid, Barcelona, Salamanca, Guadalajara, Castilla-La Mancha/León. Promoción viviendas industrializadas más grande España (Idealista). Target: Clientes buscando vivienda premium con precio/plazo cerrado.",🚀 Excelente,🔥 Alta,Madrid,⭐⭐⭐⭐⭐ Excelente Fit,🏬 Mediana (20-50 empleados),+34 914 097 180,Madrid,atlantidahomes.com,,,,,,,,,,,
Home3 Viviendas Modulares,20,,🆕 Sin Contactar,💶 1-5M€,"+20 años. Sistema propio innovador. Galicia. Llave en mano, personalizadas o a medida. Baños modulares.","HOME3 VIVIENDAS MODULARES - Casas prefabricadas modulares Galicia. Sede: Paseo Marítimo Alcalde Francisco Vázquez, S/N, 15001 A Coruña. También fábrica en Bergondo. Web: http://home3.es. +20 AÑOS construyendo casas modulares. SISTEMA PROPIO innovador adaptado economía familiar española. Construcción modular efectiva, duradera, sostenible. Materiales innovadores. Opciones: Llave en mano, personalizadas, totalmente a medida. Tamaños desde 145m² (7 módulos, 3-4 dormitorios, 2 baños). Proceso 5 pasos sencillos (pocas semanas). También: BAÑOS MODULARES PREFABRICADOS para grandes edificaciones (residencias, hospitales, hoteles, escuelas). Horario: L-V 11:00-13:30 y 16:00-20:00. Perfil Páginas Amarillas y Homify con 1 proyecto. Contacto: SOLO FORMULARIO WEB (no publican teléfono). Target: Clientes Galicia y norte España.",✅ Buena,🔥 Alta,,⭐⭐⭐⭐ Muy Buen Fit,🏪 Pequeña (5-20 empleados),,"Paseo Marítimo Alcalde Francisco Vázquez, S/N, 15001 A Coruña",home3.es,,,,,,,,,,,
Worldmetor,40,,🆕 Sin Contactar,💶 1-5M€,SISTEMA MDR PATENTADO (117 países). Única 100% fábrica. Montaje 1 día. +40 años hormigón prefabricado.,"WORLDMETOR S.L. - Dos Torres, CÓRDOBA. Fundada 2011 por Francisco Medrán. +40 AÑOS experiencia hormigón prefabricado. Web: http://worldmetor.com. SISTEMA MDR PATENTADO en 117 PAÍSES - producción en cadena módulos hormigón armado. ÚNICA EMPRESA ESPAÑA que construye 100% TOTALIDAD casa en fábrica. Sistema adaptado construcciones en serie. MONTAJE 1 DÍA. PRECIO CERRADO. Aplicaciones: viviendas y edificios. Fundadora: María Florentina García. PREMIO ANDALUCÍA EMPRENDE (II Premios). Artículo Idealista mayo 2021. Teléfono parcial: 662... (Empresite). NIF disponible. Vídeo YouTube disponible. Target: Clientes buscando máxima rapidez montaje y precio cerrado. NOTA: Contacto solo vía web - no publican teléfono completo.",✅ Buena,🔥 Alta,Córdoba,⭐⭐⭐⭐⭐ Excelente Fit,🏪 Pequeña (5-20 empleados),,"Dos Torres, Córdoba",worldmetor.com,,,,,,,,,,,
Hormitech,9,web@hormitech.es,🆕 Sin Contactar,💵 5-10M€,MAYOR DISTRIBUIDORA España. +3.400 viviendas. 18 empleados. Oficinas Madrid + Málaga + Valladolid. Desde 250.000€.,"HORMITECH - MAYOR DISTRIBUIDORA viviendas modulares hormigón España. Fundada 2016. Tel: 91 94 91 900. Email: mailto:web@hormitech.es. Web: http://hormitech.es. OFICINAS: Madrid (C/ Mahón 10, Las Rozas), Málaga (Edif. Banús Guadalmina, Marbella), Valladolid. 18 EMPLEADOS (+10.7% YoY). +3.400 VIVIENDAS ENTREGADAS. Director General: Fernando Vega. Proyectos llave en mano desde 250.000€. Opera España peninsular (NO Canarias/Baleares). Modelos: Simply (114m²), Inzu (154m²), Mukava (155m²). Redes: Facebook, Instagram, Twitter, LinkedIn. Target: Clientes media-alta gama España peninsular.",🚀 Excelente,🔥 Alta,Madrid,⭐⭐⭐⭐⭐ Excelente Fit,🏪 Pequeña (5-20 empleados),919 491 900,"C/ Mahón 10, 1ºB, 28290 Las Rozas, Madrid",hormitech.es,,,,,,,,,,,
